{
  "name": "no-ai-attribution",
  "description": "Keep AI attribution (Co-Authored-By, \"Generated with\" footers) out of git commits and pull requests.",
  "category": "meta",
  "version": "0.2.0",
  "author": {
    "name": "Emmanuel Adesina",
    "github": "Teners-net"
  },
  "license": "MIT",
  "tags": ["git", "commits", "attribution", "pull-requests"]
}
