{
  "name": "tighten-prose",
  "description": "Tighten prose by cutting filler, hedging, and redundancy without changing meaning or voice.",
  "category": "writing",
  "version": "0.1.0",
  "author": {
    "name": "Emmanuel Adesina",
    "github": "Teners-net"
  },
  "license": "MIT",
  "tags": ["writing", "editing", "prose", "concise"]
}
